{"providerId":"reference.document","providerVersion":"1.0.0","adapterVersion":"1.0.0","contractVersions":["1.0.0"],"operations":["DOCUMENT_CONVERSION"],"inputMediaTypes":["application/pdf"],"outputMediaTypes":["text/markdown","application/json"],"capabilities":["OCR","ARABIC","TABLES","LAYOUT","OFFLINE","CANCELLATION"],"offlineCapable":true,"deterministicClaim":"DETERMINISTIC","requiresNetwork":false,"binaryDigest":"bbbbbbbbbbbbbbbbbbbbbbbbbbbbbbbbbbbbbbbbbbbbbbbbbbbbbbbbbbbbbbbb","modelDigests":[],"generatedAt":"2026-07-15T00:00:00.000Z"}
